{
  "$ref": "#/definitions/services",
  "definitions": {
    "services": {
      "type": "object",
      "properties": {
        "title": {
          "type": "string"
        },
        "description": {
          "type": "string"
        },
        "image": {
          "type": "string",
          "format": "uri"
        },
        "category": {
          "type": "string",
          "enum": [
            "residential",
            "office",
            "hospitality",
            "commercial"
          ]
        },
        "$schema": {
          "type": "string"
        }
      },
      "required": [
        "title",
        "description",
        "image",
        "category"
      ],
      "additionalProperties": false
    }
  },
  "$schema": "http://json-schema.org/draft-07/schema#"
}
