{
  "title": "Hospitality Design",
  "description": "Hotels, cafés and restaurants with atmosphere you remember. Durable, guest-focused interiors that photograph beautifully and wear well.",
  "image": "https://images.unsplash.com/photo-1559329007-40df8a9345d8?auto=format&fit=crop&w=800&q=80",
  "category": "hospitality"
}