{
  "title": "Office Design",
  "description": "Workspaces that balance focus and collaboration. Acoustic planning, ergonomic furniture and brand-led finishes that people enjoy using.",
  "image": "https://images.unsplash.com/photo-1497366216548-37526070297c?auto=format&fit=crop&w=800&q=80",
  "category": "office"
}