{
  "title": "Residential Design",
  "description": "Warm, functional homes shaped around the way you live. We handle layout, materials, lighting and styling from first sketch to final install.",
  "image": "https://images.unsplash.com/photo-1600585154340-be6161a56a0c?auto=format&fit=crop&w=800&q=80",
  "category": "residential"
}