{
  "title": "Commercial Design",
  "description": "Retail and commercial spaces designed to drive engagement. We blend practical layouts with striking visuals that reflect your brand identity.",
  "image": "https://images.unsplash.com/photo-1441986300917-64674bd600d8?auto=format&fit=crop&w=800&q=80",
  "category": "commercial"
}
